{
  "version": 1,
  "width": 24,
  "height": 14,
  "palette": {
    "kind": "custom",
    "colors": [
      null,
      "#ffffff",
      "#d9fff5",
      "#1f1f1f",
      "#ffb9a8",
      "#ff5d38",
      "#ffe08a",
      "#57c84d",
      "#1bc8af",
      "#4f8dff",
      "#944ff0",
      "#0a1c52",
      "#9b6300"
    ],
    "name": "README Arcade"
  },
  "frames": [
    {
      "pixels": "LLLLLLLLLLLLLLLLLLLLLLLLLLGGGLLLLLLLLLLLLLLLLLLLLGGGGGLLLLGLLLLLLLLLLLLLLGGGGGLLLGGGLLLLLLLLLLLLLGGGBGLLLLGLLLLLLLLBLLLLLLGCGLLLLLLLLLLLLLBBBLLLLGBLLBLLLLBBLLLLLBBBBLLLGLBBBBLLLLGGLLLLBCCCCBLLLBEEEEBLLLBBLLLBCDCCDCBLHBEDEDEBHMIIIMHBCCCCCCBHIBEEEEEBMIKKKIMBCCCCCCBJIJBEGGBJMIKKKIMBBCBBCBBJIJIBGGBJIMIIIMIBIBIJBJBJIJIJBBIJIJMMIJIJIJIJIJIJ"
    },
    {
      "pixels": "LLLLLLLLLLLLLLLLLLLLLLLLLLGGGLLLLLLLLLLLLLLLLLLLLGGGGGLLLLLLLLLLLLLLLLLLLGGGGGLLBLGLLLLLLLLLLLLLLGGGGGLCLLLLLLLLLLLLLLLLLLGGGGGLLLLLLLLLLLLBLLLLLLBLGBLLLLBBLLLLLBBBBLLLLLBBBBLLLLGGLLLLBCCCCBLLLBEEEEBLLLBBLLLBCCCCCCBLHBEDEDEBHMIIIMHBCCCCCCBHIBEEEEEBMIKKKIMBCCCCCCBJIJBEGGBJMIKKKIMBBCBBCBBJIJIBGGBJIMIIIMIBIBIJBJBJIJIJBBIJIJMMIJIJIJIJIJIJ"
    },
    {
      "pixels": "LLLLLLLLLLLLLLLLLLLLLLLLLLGGGLLLLLLLLLLLLLLLLLLLLGGGGGLLLLGLBLLLLLLLLLLLLGGGGGLLLGGCLLLLLLLLLLLLLGGGGGLLLGGLLLLLLLLBLLLLLLGGGLLLGLLLLLLLLLBBBLLLLLBLLBLLLLBBLLLLLBBBBLLLLLBBBBLLLLGGLLLLBCCCCBLLLBEEEEBLLLBBLLLBCDCCDCBLHBEDEDEBHMIIIMHBCCCCCCBHIBEEEEEBMIKKKIMBCCCCCCBJIJBEGGBJMIKKKIMBBCBBCBBJIJIBGGBJIMIIIMIBIBIJBJBJIJIJBBIJIJMMIJIJIJIJIJIJ"
    },
    {
      "pixels": "LLLLLLLLLLLLLLLLLLLLLLLLLLGGGLLLLLLLLLLLLLLLLLLLLGGGGGLLLLLLLLLLLLLLLLLLLGGGGGLLLLGLLLLLLLLLLLLLLGGGGGLLLLLLLLLCLLLLLLLLLLGGGLLLLLLLLGGLLBBBBLLLLLBLLBLLLLBBGLLLBCCCCBLLLLBBBBLLLLGGLLLBCDCCDCBLLBEEEEBLLLBBLLLBCCCCCCBLHBEDEDEBHMIIIMHBCCCCCCBHIBEEEEEBMIKKKIMBCCBBCCBJIJBEGGBJMIKKKIMBBJIJIBBJIJIBGGBJIMIIIMIJBJIJIBIJIJIJBBIJIJMMIJIJIJIJIJIJ"
    }
  ],
  "animation": {
    "fps": 6,
    "loop": true
  },
  "meta": {
    "name": "Arcade Night",
    "description": "A playful hero scene assembled from reusable sprites.",
    "tags": [
      "readme",
      "hero",
      "animation"
    ]
  }
}
